{
  "schema_version": "parallel-frontend-audit-report-v1",
  "contract_version": "parallel-frontend-contract-v1",
  "scorer_version": "parallel-frontend-static-v1.0.0",
  "source_root": "C:\\Users\\Kangnaixi\\Desktop\\新建文件夹",
  "sample_count": 6,
  "ranking": [
    {
      "rank": 1,
      "file": "index.v17版本产出.html",
      "final_score": 75.55
    },
    {
      "rank": 2,
      "file": "index.v7版本产出.html",
      "final_score": 75.45
    },
    {
      "rank": 3,
      "file": "index.html",
      "final_score": 75.35
    },
    {
      "rank": 4,
      "file": "index46.html",
      "final_score": 70.61
    },
    {
      "rank": 5,
      "file": "index38.html",
      "final_score": 68.99
    },
    {
      "rank": 6,
      "file": "index.v19测试版产出.html",
      "final_score": 67.55
    }
  ],
  "items": [
    {
      "schema_version": "parallel-frontend-audit-item-v1",
      "scorer_version": "parallel-frontend-static-v1.0.0",
      "file": "index.html",
      "source": "C:\\Users\\Kangnaixi\\Desktop\\新建文件夹\\index.html",
      "sha256": "e6c08d4db2e22720e624b11c9b5bc15fd692b9011921a77c4b151a5a0f07f6ae",
      "bytes": 10548,
      "encoding": {
        "valid_utf8": true,
        "bom": false
      },
      "summary": {
        "gross_score": 78.35,
        "template_penalty": 3.0,
        "final_score": 75.35,
        "tier": "advanced"
      },
      "dimensions": {
        "structure": {
          "score": 17.0,
          "max": 18,
          "checks": [
            {
              "id": "doctype",
              "earned": 2.0,
              "max": 2.0,
              "passed": true,
              "evidence": "HTML5 doctype"
            },
            {
              "id": "single_document_skeleton",
              "earned": 3.0,
              "max": 3.0,
              "passed": true,
              "evidence": {
                "html": 1,
                "head": 1,
                "body": 1
              }
            },
            {
              "id": "title",
              "earned": 1.5,
              "max": 1.5,
              "passed": true,
              "evidence": 1
            },
            {
              "id": "charset_utf8",
              "earned": 1.5,
              "max": 1.5,
              "passed": true,
              "evidence": "meta charset=utf-8"
            },
            {
              "id": "one_h1",
              "earned": 2.0,
              "max": 2.0,
              "passed": true,
              "evidence": 1
            },
            {
              "id": "semantic_landmarks",
              "earned": 2.0,
              "max": 3.0,
              "passed": false,
              "evidence": [
                "header",
                "nav"
              ]
            },
            {
              "id": "unique_ids",
              "earned": 2.0,
              "max": 2.0,
              "passed": true,
              "evidence": []
            },
            {
              "id": "balanced_tags",
              "earned": 3.0,
              "max": 3.0,
              "passed": true,
              "evidence": []
            }
          ]
        },
        "responsive": {
          "score": 14.0,
          "max": 16,
          "checks": [
            {
              "id": "viewport",
              "earned": 3.0,
              "max": 3.0,
              "passed": true,
              "evidence": "width=device-width"
            },
            {
              "id": "media_queries",
              "earned": 2.0,
              "max": 4.0,
              "passed": false,
              "evidence": {
                "count": 1,
                "breakpoints": [
                  "768px"
                ]
              }
            },
            {
              "id": "fluid_layout",
              "earned": 3.0,
              "max": 3.0,
              "passed": true,
              "evidence": [
                "0%",
                "100%",
                "100vh",
                "20%",
                "30%",
                "40%",
                "60%",
                "70%",
                "8vw",
                "minmax("
              ]
            },
            {
              "id": "adaptive_layout_modes",
              "earned": 2.0,
              "max": 2.0,
              "passed": true,
              "evidence": [
                "grid",
                "flex"
              ]
            },
            {
              "id": "responsive_media",
              "earned": 1.5,
              "max": 1.5,
              "passed": true,
              "evidence": "媒体 max-width 或无位图媒体"
            },
            {
              "id": "no_obvious_horizontal_overflow",
              "earned": 2.5,
              "max": 2.5,
              "passed": true,
              "evidence": {
                "oversized_px": []
              }
            }
          ]
        },
        "interaction": {
          "score": 11.25,
          "max": 16,
          "checks": [
            {
              "id": "meaningful_controls",
              "earned": 3.0,
              "max": 3.0,
              "passed": true,
              "evidence": {
                "interactive": 5,
                "meaningful_links": 0,
                "buttons": 1
              }
            },
            {
              "id": "event_wiring",
              "earned": 3.75,
              "max": 4.0,
              "passed": false,
              "evidence": [
                "addEventListener",
                "classList.",
                "querySelector"
              ]
            },
            {
              "id": "interaction_states",
              "earned": 1.0,
              "max": 3.0,
              "passed": false,
              "evidence": [
                "hover"
              ]
            },
            {
              "id": "bounded_transition",
              "earned": 1.5,
              "max": 1.5,
              "passed": true,
              "evidence": "150–300ms transition"
            },
            {
              "id": "no_obvious_dead_controls",
              "earned": 0.0,
              "max": 2.5,
              "passed": false,
              "evidence": {
                "placeholder_link_lines": [
                  278,
                  279,
                  280,
                  281
                ],
                "inert_button_risk": false
              }
            },
            {
              "id": "form_path",
              "earned": 2.0,
              "max": 2.0,
              "passed": true,
              "evidence": {
                "forms": 0
              }
            }
          ]
        },
        "visual_complexity": {
          "score": 15.6,
          "max": 20,
          "checks": [
            {
              "id": "css_depth",
              "earned": 4.0,
              "max": 4.0,
              "passed": true,
              "evidence": {
                "rules": 34,
                "properties": 159
              }
            },
            {
              "id": "content_composition",
              "earned": 1.6,
              "max": 4.0,
              "passed": false,
              "evidence": {
                "sections_articles": 1,
                "landmarks": 2
              }
            },
            {
              "id": "visual_techniques",
              "earned": 5.0,
              "max": 5.0,
              "passed": true,
              "evidence": [
                "grid",
                "flex",
                "gradient",
                "shadow",
                "filter",
                "animation",
                "transform",
                "custom-properties",
                "pseudo-elements"
              ]
            },
            {
              "id": "design_tokens",
              "earned": 3.0,
              "max": 3.0,
              "passed": true,
              "evidence": {
                "colors": 16,
                "font_stacks": 1
              }
            },
            {
              "id": "visual_assets",
              "earned": 0.5,
              "max": 2.0,
              "passed": false,
              "evidence": {
                "media": 0
              }
            },
            {
              "id": "typography_system",
              "earned": 1.5,
              "max": 2.0,
              "passed": false,
              "evidence": [
                "weight",
                "line-height",
                "letter-spacing"
              ]
            }
          ]
        },
        "dependency_safety": {
          "score": 8.5,
          "max": 10,
          "checks": [
            {
              "id": "external_dependency_risk",
              "earned": 8.5,
              "max": 10.0,
              "passed": false,
              "evidence": {
                "total": 3,
                "active": 3,
                "http": 0,
                "third_party_scripts": 0,
                "unpinned_active": 0,
                "remote_assets": 3,
                "hosts": [
                  "images.unsplash.com"
                ]
              }
            }
          ]
        },
        "accessibility": {
          "score": 12.0,
          "max": 20,
          "checks": [
            {
              "id": "document_language",
              "earned": 2.0,
              "max": 2.0,
              "passed": true,
              "evidence": "zh-CN"
            },
            {
              "id": "image_alternatives",
              "earned": 3.0,
              "max": 3.0,
              "passed": true,
              "evidence": {
                "images": 0,
                "missing_alt_lines": []
              }
            },
            {
              "id": "form_labels",
              "earned": 3.0,
              "max": 3.0,
              "passed": true,
              "evidence": {
                "controls": 0,
                "unlabeled_lines": []
              }
            },
            {
              "id": "control_names",